{
  "id": "ace3-u1-answers",
  "book_id": "ace3",
  "theme_id": "ace3-u1",
  "title": "New Ace 3 — Unit 1 First day",
  "provenance": "source_core",
  "rights_status": "licensed_confirmed",
  "use_scope": "own_lesson_groups",
  "teacher_only": true,
  "derivation": "manual_inventory",
  "derivation_note_nl": "Overgenomen uit het ingevulde digiboek via een handmatige inventaris, niet via de OCR-pijplijn. Paginanummers zijn boekpagina's.",
  "source_page_offset": 8,
  "exercises": [
    {
      "id": "ace3-u1-ex-01",
      "number": "1",
      "part": "1 Friends With Boys",
      "page": 10,
      "section": "reading",
      "open_ended": true,
      "note_nl": "Leerlingen leiden af wat ze uit de eerste drie stripbladzijden opmaken. Let erop dat ze zich baseren op wat ze effectief zien (kamer, wekker, meisje dat zich klaarmaakt, \"FIRST DAY\") en niet op gissingen over het verdere verhaal."
    },
    {
      "id": "ace3-u1-ex-02",
      "number": "2",
      "part": "1 Friends With Boys",
      "page": 13,
      "section": "reading",
      "items": [
        { "number": "1", "answer": "unhappy, nervous, scared …", "note_nl": "De puntjes geven aan dat andere gevoelswoorden ook mogen." },
        { "number": "2", "answer": "No, because she meets a girl who smiles and is friendly. She makes a friend." },
        { "number": "3", "answer": "She often thinks about her mother." },
        { "number": "4", "answer": "He is a police officer." },
        { "number": "5", "answer": "Magsby" },
        { "number": "6", "answer": "Because Zander is four minutes older than Lloyd." },
        { "number": "7", "answer": "They live in Sandford." },
        { "number": "8", "answer": "Daniel and his drama club friends" },
        { "number": "9", "answer": "Daniel" },
        { "number": "10", "answer": "three: Daniel, Zander and Lloyd" }
      ]
    },
    {
      "id": "ace3-u1-ex-03",
      "number": "3",
      "label_nl": "Present continuous",
      "part": "1 Friends With Boys",
      "page": 17,
      "section": "grammar",
      "items": [
        { "number": "1", "answer": "is hanging" },
        { "number": "2", "answer": "is shining" },
        { "number": "3", "answer": "is ringing" },
        { "number": "4", "answer": "is making" },
        { "number": "5", "answer": "is hitting" },
        { "number": "6", "answer": "is repeating" },
        { "number": "7", "answer": "is having" },
        { "number": "8", "answer": "is brushing" },
        { "number": "9", "answer": "is drying" },
        { "number": "10", "answer": "is staring" },
        { "number": "11", "answer": "isn't feeling", "alternatives": ["is not feeling"] },
        { "number": "12", "answer": "are smiling" },
        { "number": "13", "answer": "is running" },
        { "number": "14", "answer": "is happening" },
        { "number": "15", "answer": "is he frowning" },
        { "number": "16", "answer": "Is he thinking" }
      ]
    },
    {
      "id": "ace3-u1-ex-04",
      "number": "4",
      "label_nl": "Gevoelens",
      "part": "1 Friends With Boys",
      "page": 18,
      "section": "vocabulary",
      "items": [
        { "number": "annoyed", "answer": "3" },
        { "number": "confused", "answer": "1" },
        { "number": "sad", "answer": "4" },
        { "number": "scared", "answer": "5" },
        { "number": "surprised", "answer": "2" }
      ]
    },
    {
      "id": "ace3-u1-ex-05",
      "number": "5",
      "label_nl": "Persoonlijkheid",
      "part": "1 Friends With Boys",
      "page": 18,
      "section": "vocabulary",
      "items": [
        { "number": "1", "answer": "Maggie", "note_nl": "nervous, worried, lonely, insecure, shy" },
        { "number": "2", "answer": "Daniel", "note_nl": "excited, enthusiastic, popular, modest, outgoing" },
        { "number": "3", "answer": "father", "note_nl": "caring, helpful, quiet, calm" },
        { "number": "4", "answer": "Zander", "note_nl": "bitter, angry, moody, sarcastic" },
        { "number": "5", "answer": "Lloyd", "note_nl": "energetic, loud, playful, naughty" },
        { "number": "6", "answer": "Lucy", "note_nl": "curious, friendly, cheerful, sociable" }
      ]
    },
    {
      "id": "ace3-u1-ex-06",
      "number": "6",
      "label_nl": "Persoonlijkheid in context",
      "part": "1 Friends With Boys",
      "page": 19,
      "section": "vocabulary",
      "instruction_nl": "Alleen de aangevulde woorddelen; het boek geeft telkens de beginletter.",
      "note_nl": "De koppelingen naar de Simpsons-personages (\"In Springfield, you would be …\") zijn met lijnen aangeduid. Die lijnen zijn op de scan niet betrouwbaar te volgen, dus staan hier geen antwoorden voor.",
      "items": [
        { "number": "1", "answer": "popular / sociable" },
        { "number": "2", "answer": "enthusiastic" },
        { "number": "3", "answer": "calm / quiet" },
        { "number": "4", "answer": "caring / helpful" },
        { "number": "5", "answer": "lonely" },
        { "number": "6", "answer": "curious" },
        { "number": "7", "answer": "friendly / modest" },
        { "number": "8", "answer": "sarcastic" },
        { "number": "9", "answer": "energetic / outgoing" },
        { "number": "10", "answer": "shy / insecure / nervous" },
        { "number": "11", "answer": "loud / naughty" },
        { "number": "12", "answer": "bitter / moody" },
        { "number": "13", "answer": "cheerful / playful" }
      ]
    },
    {
      "id": "ace3-u1-ex-07",
      "number": "7",
      "part": "1 Friends With Boys",
      "page": 20,
      "section": "speaking",
      "open_ended": true,
      "note_nl": "Leerlingen beschrijven gevoelens bij vijf Rockwell-fragmenten. Let erop dat ze hun interpretatie koppelen aan concrete beeldelementen (blik, houding, context)."
    },
    {
      "id": "ace3-u1-ex-08",
      "number": "8",
      "part": "1 Friends With Boys",
      "page": 20,
      "section": "speaking",
      "open_ended": true,
      "note_nl": "Try this: een uitsnede posten met bijschrift, daarna de volledige foto. Let op het contrast tussen het bijschrift en wat er echt gebeurt."
    },
    {
      "id": "ace3-u1-ex-09",
      "number": "9",
      "label_nl": "Present simple, korte vormen",
      "part": "1 Friends With Boys",
      "page": 21,
      "section": "grammar",
      "items": [
        { "number": "1", "answer": "becomes" },
        { "number": "2", "answer": "stays" },
        { "number": "3", "answer": "doesn't get up" },
        { "number": "4", "answer": "aren't" },
        { "number": "5", "answer": "doesn't have" },
        { "number": "6", "answer": "has" },
        { "number": "7", "answer": "rushes" },
        { "number": "8", "answer": "doesn't want" },
        { "number": "9", "answer": "cries" },
        { "number": "10", "answer": "does" },
        { "number": "11", "answer": "joins" },
        { "number": "12", "answer": "don't talk" },
        { "number": "13", "answer": "realises" },
        { "number": "14", "answer": "doesn't have", "alternatives": ["hasn't got"], "uncertain": true },
        { "number": "15", "answer": "tries" },
        { "number": "16", "answer": "watches" },
        { "number": "17", "answer": "goes" }
      ]
    },
    {
      "id": "ace3-u1-ex-10",
      "number": "10",
      "part": "1 Friends With Boys",
      "page": 21,
      "section": "speaking",
      "open_ended": true,
      "note_nl": "Klasactiviteit \"find out how much you have in common\". Let op correcte vraagvorming in de present simple."
    },
    {
      "id": "ace3-u1-ex-11",
      "number": "11",
      "part": "1 Friends With Boys",
      "page": 21,
      "section": "listening",
      "items": [
        { "number": "1", "answer": "She makes graphic novels. She wrote Friends With Boys." },
        { "number": "2", "answer": "There is a ghost." },
        { "number": "3", "answer": "teenage girls" },
        { "number": "4", "answer": "false" }
      ]
    },
    {
      "id": "ace3-u1-ex-12",
      "number": "12",
      "label_nl": "Word order in questions",
      "part": "1 Friends With Boys",
      "page": 22,
      "section": "grammar",
      "instruction_nl": "Kopvraag \"What kind of personality does Faith have?\" is open: laat leerlingen adjectieven uit opdracht 5 en 6 gebruiken en met de FAQ staven.",
      "items": [
        { "number": "a", "answer": "you — Why do you like comics? / Do you want to work together …? / How much money do you ask …? / Can you give any advice …? / Are you a manga fan?", "note_nl": "Het onderwerp is in elke vraag gemarkeerd." },
        { "number": "a", "answer": "Who — helps you with the drawings? / is the target audience …?" },
        { "number": "a", "answer": "Which characters — in Friends with Boys are autobiographical?" },
        { "number": "b", "answer": "to be", "note_nl": "Questions with … as a main verb do not use the auxiliary to do." },
        { "number": "b", "answer": "subject", "note_nl": "When the question word is (part of) the … of the sentence, you do not use the auxiliary to do." }
      ]
    },
    {
      "id": "ace3-u1-ex-13",
      "number": "13",
      "label_nl": "Vragen vormen",
      "part": "1 Friends With Boys",
      "page": 23,
      "section": "grammar",
      "items": [
        { "number": "1", "answer": "What kind of comics does Faith like?" },
        { "number": "2", "answer": "Does Faith read other types of comics?" },
        { "number": "3", "answer": "How much time does Faith need to draw one page?" },
        { "number": "4", "answer": "What does Faith find the most difficult part of making comics?" },
        { "number": "5", "answer": "How do you feel about manga comics?" },
        { "number": "6", "answer": "What happens in Monster?" },
        { "number": "7", "answer": "Are there any Japanese characters in this manga?" },
        { "number": "8", "answer": "Which characters play an important part in the story?" },